{
  "schema_version": "1.0.0",
  "case_id": "case_0002",
  "purpose": "aml.cdd.onboarding",
  "state": "decided",
  "created_at": "2026-09-02T14:00:00Z",
  "updated_at": "2026-09-02T15:30:00Z",
  "application": {
    "legal_name": "Hollowbrook Tool and Die LLC",
    "trading_names": [],
    "jurisdiction": "US-DE",
    "identifiers": [
      {"scheme": "us_ein", "value": "00-0000001"},
      {"scheme": "us_state_file_number", "value": "0000001"}
    ],
    "registered_address": {
      "lines": ["100 Example Avenue", "Suite 5"],
      "locality": "Exampleville",
      "region": "DE",
      "postal_code": "00000",
      "country": "US"
    },
    "website": null,
    "declared_activity": null,
    "declared_owners": [
      {
        "name": "Wendeline Ashgrove",
        "kind": "person",
        "date_of_birth": "1966",
        "nationalities": ["US"],
        "ownership_pct": 100,
        "identifiers": []
      }
    ]
  },
  "subject": {
    "provider": "mock",
    "provider_ref": "mock-us-de-0000001",
    "jurisdiction": "US-DE",
    "identifiers": [{"scheme": "us_state_file_number", "value": "0000001"}]
  },
  "decision": {
    "outcome": "approve",
    "approvers": [
      {"approver": "user:approver-a", "decision_grant_id": "dg-0000000000000001"}
    ],
    "decided_at": "2026-09-02T15:30:00Z"
  }
}
